<?xml version="1.0"?>

<simulationConfig xmlns:xsi="http://www.w3.org/2001/XMLSchema-instance"
       xsi:noNamespaceSchemaLocation="simulationConfig.xsd">
       
  <deltaT>0.00005</deltaT>
  <endTime>15</endTime>
  <dimensions>2</dimensions>
  <scenarioType>Lennard-Jones</scenarioType>
  <domainSize x0="303" x1="180.0" x2="7.5" />
  <cutoffRadius scaled="1" radius="2.3" />
  <boundaryHandling
  	top="Reflect" bottom="Reflect"
  	left="Periodic" right="Periodic"
  	front="Reflect" back="Reflect"
  />
  <containerType>CellListContainer</containerType>
  <gravitation x0="0" x1="-12.44" x2="0" />  <outputFrequency>100</outputFrequency>
  <disableOutput>0</disableOutput>
  <loggerConfigFile>Logger.properties</loggerConfigFile>
  <outputFilePrefix>OutputFiles/MD_vtk</outputFilePrefix>
  <outputFileType>vtk</outputFileType>
  <saveLastState>drop.state</saveLastState>
  <inputFile></inputFile>
  
  <thermostatSwitch>ON</thermostatSwitch>
 <thermostatSettings>
  	<initTemperature>0.5</initTemperature>
  	<targetTemperature>0.5</targetTemperature>
  	<controlInterval>1000</controlInterval>
  	<temperatutePerStep>-1</temperatutePerStep>
 </thermostatSettings> 
  
<typeList>
 <particleType mass = "1.0" sigma = "1.2" epsilon = "1.0" />
 <particleType mass = "1.0" sigma = "1.1" epsilon = "1.0" />
 </typeList> 
 
  <generator>
<!--  <sphere>
      <center x0="150" x1="150" x2="3.75" />
      <radius>20</radius>
      <stepWidth>1.2</stepWidth>
      <mass>1</mass>
      <type>1</type>
      <initialVelocity x0="0" x1="0" x2="0"/>
      <brownianMeanVelocity>0.0</brownianMeanVelocity>
    </sphere>  -->
	 <cuboid>
      <bottomLeft x0="1.5" x1="2" x2="3.75" />
      <nX x0="250" x1="50" x2="1" />
      <stepWidth>1.2</stepWidth>
      <type>0</type>
      <initialVelocity x0="0" x1="0" x2="0"/>
   </cuboid>
    
  </generator>
  

</simulationConfig>
