<?xml version="1.0"?>

<simulationConfig xmlns:xsi="http://www.w3.org/2001/XMLSchema-instance"
       xsi:noNamespaceSchemaLocation="simulationConfig.xsd">
       
<!--(m): mandatory (o): optional-->     
  
  <deltaT>0.01</deltaT>
  <endTime>350</endTime>
  <dimensions>3</dimensions> <!-- (o) Standard is 3, For a two dimensionalSimulation all particles should have the same z value > 0  --> 
  <scenarioType>Membrane</scenarioType> <!-- (m) Possible: Gravitational, Lennard-Jones, Membrane  -->
  <domainSize x0="148" x1="148" x2="148" /><!-- (m) -->
  <cutoffRadius scaled="1" radius="4.0" /><!-- (m) scaled implies whether the radius is scaled by the greatest sigma value or not-->

  <boundaryHandling
  	top="Periodic" bottom="Periodic"					
  	left="Periodic" right="Periodic"		
  	front="Reflect" back="Reflect"
  />
  
  <containerType>CellListContainer</containerType> <!-- (m) Possible: ParticleContainer , CelllistContainer -->
  <gravitation x0="0" x1="0" x2="-0.001" /> <!-- (o) -->
  <outputFrequency>100</outputFrequency>
  <disableOutput>0</disableOutput>
  <loggerConfigFile>Logger.properties</loggerConfigFile>
  <outputFilePrefix>OutputFiles/MD_vtk_2</outputFilePrefix>
  <outputFileType>vtk</outputFileType> 
  <saveLastState>state2.state</saveLastState> <!--(o) for a given filePath the last state of the particles is saved (can be used as inputFile afterwards) -->
  <inputFile>state.state</inputFile> <!-- (o)  -->
  
  <thermostatSwitch>OFF</thermostatSwitch> <!-- (o) Possible:ON , OFF indicates whether the given thermostat is used. is switched OFF if left out -->


  
 <typeList> <!-- (m) a List of types recognized by the particle generator for applying unique values for sigma and epsilon -->
 <particleType 
 		sigma="1" 
 		epsilon="1"
 		mass="1"  
 		isMolecule="true" 
 		stiffness="300" 
 		averageBondLength="2.2"
 		nX0="5" nX1="5" nX2="1" />
 </typeList>  

 <generator>

  </generator>

</simulationConfig>
