<?xml version="1.0"?>

<simulationConfig xmlns:xsi="http://www.w3.org/2001/XMLSchema-instance"
       xsi:noNamespaceSchemaLocation="simulationConfig.xsd">
       
<!--(m): mandatory (o): optional-->     
  
  <deltaT>0.0005</deltaT>
  <endTime>100</endTime>
  <dimensions>3</dimensions> <!-- (o) Standrat is 3, For a two dimensionalSimulation all particles should have the same z value > 0  --> 
  <scenarioType>Lennard-Jones</scenarioType> <!-- (m) Possible: Gravitational, Lennard-Jones, Lennard-Jones-Gravitational -->
  <domainSize x0="60" x1="24" x2="51" /><!-- (m) -->
  <cutoffRadius scaled="1" radius="2.5" /><!-- (m) scaled implies whether the radius is scaled by the greatest sigma value or not-->

<!-- (m) Possible: Outflow, Reflect ,Periodic -->
<!-- Periodic and Reflect on opposite boundaries doesn't work due implementation -->
  <boundaryHandling						
  	top="Reflect" bottom="Reflect"					
  	left="Reflect" right="Reflect"		
  	front="Reflect" back="Reflect"
  />
  
  <containerType>CelllistContainer</containerType> <!-- (m) Possible: ParticleContainer , CellListContainer -->
  <gravitation x0="0" x1="-12.44" x2="0" /> <!-- (o) used in Lennard-Jones-Gravitational, is set to -9.89 if left out -->
  <outputFrequency>100</outputFrequency>
  <disableOutput>0</disableOutput>
  <loggerConfigFile>Logger.properties</loggerConfigFile>
  <outputFilePrefix>OutputFiles/Rayleigh_Taylor</outputFilePrefix>
  <outputFileType>vtk</outputFileType> 
  <saveLastState></saveLastState> <!--(o) for a given filePath the last state of the particles is saved (can be used as inputFile afterwards) -->
  <inputFile></inputFile> <!-- (o)  -->
  
  <thermostatSwitch>ON</thermostatSwitch> <!-- (o) Possible:ON , OFF indicates whether the given thermostat is used. is switched OFF if left out -->

  <thermostatSettings> <!-- (o) if left out thermostatSwitch is set OFF -->
	<initTemperature>-233.2</initTemperature> <!-- (o) -->
  	<controlInterval>1000</controlInterval><!-- (r) the interval the thermostat is applied, it tries to reach the target temperature until the next step -->
  </thermostatSettings>
  
 <typeList> <!-- (o) a List of types recognized by the particle generator for applying unique values for sigma and epsilon -->
 <particleType mass="40.0" sigma="1.15" epsilon ="2.0"/><!-- (o)  -->
 <particleType mass="80.0" sigma="1.15" epsilon ="2.0"/><!-- (o)  -->
 
 </typeList>  
 
 <generator>
   <cuboid>
      <bottomLeft x0="0.6" x1="0.6" x2="0.6" />
      <nX x0="48" x1="9" x2="42" />
      <stepWidth>1.2</stepWidth>
      <type>0</type>
      <initialVelocity x0="0" x1="0" x2="0"/>
    </cuboid>
   <cuboid>
      <bottomLeft x0="0.6" x1="11.4" x2="0.6" />
      <nX x0="48" x1="9" x2="42" />
      <stepWidth>1.2</stepWidth>
      <type>1</type>
      <initialVelocity x0="0" x1="0" x2="0"/>
    </cuboid> 
  </generator>
  

</simulationConfig>
