<?xml version="1.0"?>

<simulationConfig xmlns:xsi="http://www.w3.org/2001/XMLSchema-instance"
       xsi:noNamespaceSchemaLocation="simulationConfig.xsd">
       
  <deltaT>0.005</deltaT>
  <endTime>10</endTime>
  <scenarioType>Lennard-Jones</scenarioType>
  <domainSize x0="100.0" x1="100.0" x2="20.0" />
  <boundaryHandling
  	top="Outflow" bottom="Outflow"
  	left="Outflow" right="Outflow"
  	front="Outflow" back="Outflow"
  />
  <containerType>ParticleContainer</containerType>
  <epsilon>5</epsilon>
  <sigma>1</sigma>
  <outputFrequency>100</outputFrequency>
  <disableOutput>0</disableOutput>
  <loggerConfigFile>Logger.properties</loggerConfigFile>
  <outputFilePrefix>OutputFiles/MD_vtk</outputFilePrefix>
  <outputFileType>vtk</outputFileType>
  <cutoffRadius>3.0</cutoffRadius>
  <inputFile></inputFile>

  <generator>
  <!--<sphere>
      <center x0="60" x1="25.0" x2="0.0" />
      <radius>15</radius>
      <stepWidth>1.1225</stepWidth>
      <mass>1</mass>
      <type>1</type>
      <initialVelocity x0="0" x1="-20" x2="0"/>
      <brownianMeanVelocity>0.0</brownianMeanVelocity>
    </sphere>  -->
	 <cuboid>
      <bottomLeft x0="50" x1="50" x2="10" />
      <nX x0="31" x1="31" x2="1" />
      <stepWidth>1.1225</stepWidth>
      <mass>1</mass>
      <type>2</type>
      <initialVelocity x0="0" x1="-10" x2="0"/>
      <brownianMeanVelocity>0.1</brownianMeanVelocity>
   </cuboid>
    
  </generator>
  

</simulationConfig>
